{
  "match_id": "epl-2025-26-arsenal-vs-chelsea-gw12",
  "competition_id": "epl",
  "kickoff_utc": "2025-11-08T17:30:00Z",
  "home_team_id": "arsenal",
  "away_team_id": "chelsea",
  "generated_at": "2025-11-08T12:00:00Z",
  "data_cutoff_at": "2025-11-08T11:55:00Z",
  "model_version": "fie-dc-lgbm-v0.1.0",
  "probabilities": {
    "home_win": 0.46,
    "draw": 0.27,
    "away_win": 0.27
  },
  "expected_goals": {
    "home": 1.48,
    "away": 1.07
  },
  "scoreline_matrix": {
    "0-0": 0.08,
    "1-0": 0.12,
    "1-1": 0.12,
    "2-0": 0.09,
    "2-1": 0.10,
    "0-1": 0.07,
    "1-2": 0.06,
    "2-2": 0.05
  },
  "markets": {
    "over_2_5": 0.49,
    "under_2_5": 0.51,
    "btts_yes": 0.44,
    "btts_no": 0.56
  },
  "confidence": {
    "score": 0.71,
    "tier": "medium",
    "uncertainty_drivers": [
      "unconfirmed_starting_xi",
      "late_injury_window"
    ]
  },
  "explanations": [
    {
      "factor": "home_attack_vs_away_defense",
      "impact": "positive",
      "weight": 0.22
    },
    {
      "factor": "away_key_creator_absence",
      "impact": "positive",
      "weight": 0.14
    },
    {
      "factor": "rest_days_advantage_home",
      "impact": "positive",
      "weight": 0.08
    },
    {
      "factor": "market_line_moved_away",
      "impact": "negative",
      "weight": -0.06
    }
  ],
  "intelligence": {
    "key_absences": [
      {
        "team_id": "chelsea",
        "player_name": "Key Creator",
        "reason": "injury",
        "impact_score": 0.18
      }
    ],
    "context_flags": [
      "midweek_european_fixture_away",
      "expected_rain"
    ],
    "sources": [
      "api-football",
      "the-odds-api",
      "open-meteo",
      "club-official-rss"
    ]
  }
}
